{
  "blocked": [],
  "fingerprint": "80b28e86cd475c98a97045b9f712a58320444905b653a2b6937b6d95d81f0246",
  "loss_accounting": {
    "preview": {
      "discarded-suffix": 0,
      "none": 0,
      "truncated-projection": 0
    }
  },
  "profile": "neutral",
  "source_hash": "1f29d80685dd355b2bbf0f74febc5031bd1b774bbdd29d8bc576a99353cc6c7a",
  "steps": [],
  "version": "sesslint.plan/v1"
}
