{
  "blocked": [],
  "fingerprint": "0e69c071ffe361444dbd0a7aaa4a3e08a21ceede09f63b2ccb802b93c860449e",
  "loss_accounting": {
    "preview": {
      "discarded-suffix": 0,
      "none": 0,
      "truncated-projection": 0
    }
  },
  "profile": "neutral",
  "source_hash": "37dd688ea237150ff3c0e7adf775b9c52bf9b1a93370d0842f86626ec6ae1b3b",
  "steps": [
    {
      "min_policy": "conservative",
      "params": {
        "first_index": 1,
        "record_indexes": [
          1,
          2
        ],
        "variant": "identical-duplicate"
      },
      "recipe": "identical-duplicate-collapse",
      "recipe_version": "1.0.0",
      "seq": 0,
      "target_finding_fp": "b323969e9dfca06a",
      "target_index": 1
    }
  ],
  "version": "sesslint.plan/v1"
}
