{
  "blocked": [],
  "fingerprint": "d6e4585c7c09df3b53faaf14ee5fdef615b7a89fc43b60ba43ff14b9f9b271d4",
  "loss_accounting": {
    "preview": {
      "discarded-suffix": 0,
      "none": 0,
      "truncated-projection": 0
    }
  },
  "profile": "neutral",
  "source_hash": "37dd688ea237150ff3c0e7adf775b9c52bf9b1a93370d0842f86626ec6ae1b3b",
  "steps": [
    {
      "min_policy": "conservative",
      "params": {},
      "recipe": "identical-duplicate-collapse",
      "recipe_version": "1.0.0",
      "seq": 0,
      "target_finding_fp": "070ceee4b3954eb0",
      "target_index": 1
    }
  ],
  "version": "sesslint.plan/v1"
}
