{
  "blocked": [],
  "fingerprint": "dd62c71f294ad5ced57a1f9448cc52604b41323f70c240c6d251d70a20ac2fc6",
  "loss_accounting": {
    "preview": {
      "discarded-suffix": 0,
      "none": 0,
      "truncated-projection": 0
    }
  },
  "profile": "neutral",
  "source_hash": "1f29d80685dd355b2bbf0f74febc5031bd1b774bbdd29d8bc576a99353cc6c7a",
  "steps": [
    {
      "min_policy": "conservative",
      "params": {
        "first_index": 1,
        "record_indexes": [
          1,
          2
        ],
        "variant": "identical-duplicate"
      },
      "recipe": "identical-duplicate-collapse",
      "recipe_version": "1.0.0",
      "seq": 0,
      "target_finding_fp": "b323969e9dfca06a",
      "target_index": 1
    },
    {
      "min_policy": "conservative",
      "params": {},
      "recipe": "seq-renumber",
      "recipe_version": "1.0.0",
      "seq": 1,
      "target_finding_fp": "-",
      "target_index": null
    }
  ],
  "version": "sesslint.plan/v1"
}
